UID,Title,PublicationDate,PublicationYear
19783112,pneumocystis jiroveci pneumonia in an immunocompetent female patient,2010 Apr,2010
19782871,aids treatment in brazil what kind of evidence do we need,2009 Sep 26,2009
19782638,microbial translocation is associated with residual viral replication in haart treated hiv subjects with 50copies ml hiv 1 rna,2009 Dec,2009
19782636,hiv 1 infection of a nurse from a newborn with an unknown hiv infection a case report,2009 Dec,2009
19782531,late stage hiv aids patients and their familial caregivers agreement on the palliative care outcome scale,2010 Jan,2010
19782103,novel approaches to inhibiting hiv 1 replication,2010 Jan,2010
19782024,chicken or the egg microrna mediated regulation of mrna translation or mrna stability,2009 Sep 24,2009
19781889,effects of a cognitive behavioral self help program and a computerized structured writing intervention on depressed mood for hiv infected people a pilot randomized controlled trial,2010 Aug,2010
19781881,posterior reversible encephalopathy related to tacrolimus in a liver transplanted hiv patient,2010 Jan,2010
19781770,use of pegylated poly 2 n n dimethylamino ethyl methacrylate as a mucosal dna delivery vector and the activation of innate immunity and improvement of hiv 1 specific immune responses,2010 Jan,2010
19781728,cathepsin l is required for ecotropic murine leukemia virus infection in nih3t3 cells,2009 Nov 25,2009
19781578,non nucleoside reverse transcriptase inhibitors nnrtis their discovery development and use in the treatment of hiv 1 infection a review of the last 20 years 1989 2009,2010 Jan,2010
19781520,nmr structure of the transmembrane and cytoplasmic domains of human cd4 in micelles,2010 Feb,2010
19780945,hiv hcv co infected patients with low cd4 cell nadirs are at risk for faster fibrosis progression and portal hypertension,2010 Jun,2010
19780936,impact of the prevention programme of hepatitis c over more than a decade the french experience,2010 Jun,2010
19780862,risk factors for hiv transmission among heterosexual discordant couples in south india,2010 Mar,2010
19780860,prospective epidemiological study of the prevalence of human leukocyte antigen hla b 5701 in hiv 1 infected uk subjects,2010 Mar,2010
19780857,preventive hiv vaccine acceptability and behavioral risk compensation among a random sample of high risk adults in los angeles la voices,2009 Dec,2009
19780477,opinions on the church s stand against condom use by the youth,2009 Mar,2009
19780455,boosting vaccine power,2009 Oct,2009
19779969,grandmothers as gems of genetic wisdom exploring south african traditional beliefs about the causes of childhood genetic disorders,2010 Feb,2010
19779705,oral cyclosporin a inhibits cd4 t cell p glycoprotein activity in hiv infected adults initiating treatment with nucleoside reverse transcriptase inhibitors,2009 Nov,2009
19779688,the standard implantation of a total hip prosthesis via two incisions the yale technique,2009 Sep,2009
19779624,early outcomes of mdr tb treatment in a high hiv prevalence setting in southern africa,2009 Sep 25,2009
19779560,molecular phylodynamics of the heterosexual hiv epidemic in the united kingdom,2009 Sep,2009
19779394,protease inhibitor resistance in south african children with virologic failure,2009 Dec,2009
19779391,congenital transmission of human immunodeficiency virus cytomegalovirus and toxoplasmosis in a premature infant,2009 Dec,2009
19779355,early weaning of hiv exposed uninfected infants and risk of serious gastroenteritis findings from two perinatal hiv prevention trials in kampala uganda,2010 Jan,2010
19779322,viral hepatitis is associated with reduced bone mineral density in hiv infected women but not men,2009 Oct 23,2009
19779320,prognosis of patients treated with cart from 36 months after initiation according to current and previous cd4 cell count and plasma hiv 1 rna measurements,2009 Oct 23,2009
19779312,screening adolescent patients admitted to the trauma service for high risk behaviors who is responsible,2009 Dec,2009
19779309,tonsillar application of at 2 siv affords partial protection against rectal challenge with sivmac239,2009 Dec 1,2009
19779308,detectable hiv viral load is associated with metabolic syndrome,2009 Dec 1,2009
19779307,low frequency k103n strengthens the impact of transmitted drug resistance on virologic responses to first line efavirenz or nevirapine based highly active antiretroviral therapy,2009 Dec,2009
19779306,efficacy of trichloroacetic acid in the treatment of anal intraepithelial neoplasia in hiv positive and hiv negative men who have sex with men,2009 Dec 1,2009
19778955,mucocutaneous manifestations in 150 hiv infected indian patients and their relationship with cd4 lymphocyte counts,2009 Nov,2009
19778766,successes challenges and limitations of current antiretroviral therapy in low income and middle income countries,2009 Oct,2009
19778765,progressive multifocal leukoencephalopathy in hiv 1 infection,2009 Oct,2009
19778760,beyond cholera the zimbabwe health crisis,2009 Oct,2009
19778737,endodontic management of a mandibular first molar with three distal canals confirmed with the aid of spiral computerized tomography a case report,2009 Oct,2009
19778551,mecamylamine dihydro beta erythroidine and dextromethorphan block conditioned responding evoked by the conditional stimulus effects of nicotine,2009 Dec,2009
19778458,hiv 1 heterosexual transmission chain in guangzhou china a molecular epidemiological study,2009 Sep 25,2009
19778313,antiretroviral induced toxic epidermal necrolysis in a patient positive for human immunodeficiency virus,2009 Dec,2009
19778269,short communication rna interference directed against axin1 upregulates human immunodeficiency virus type 1 gene expression by activating the wnt signaling pathway in hela derived j111 cells,2009 Oct,2009
19777784,mother to child hiv and hhv 8 transmission in neonates at saint camille medical centre in burkina faso,2009 Jun 15,2009
19740178,preventing mother to child transmission of hiv,2009 Oct,2009
19777528,mathematical modelling of the impact of haematopoietic stem cell delivered gene therapy for hiv,2009 Dec,2009
19777225,identification of novel mhc class i sequences in pig tailed macaques by amplicon pyrosequencing and full length cdna cloning and sequencing,2009 Oct,2009
19776781,hiv and kidney disease in sub saharan africa,2009 Oct,2009
19776780,renal transplantation in patients with hiv,2009 Oct,2009
19776778,nephrotoxic effects of haart,2009 Oct,2009
19776541,pityriasis rubra pilaris with preceding cytomegalovirus infection,2009,2009
19776532,prevalence of and clinical factors associated with lipoatrophy in hiv infected koreans receiving highly active antiretroviral therapy,2009 Oct,2009
19776326,decision making impairment in a patient with new concomitant diagnoses of parkinson s disease and hiv,2009 Summer,2009
19776241,hla c is necessary for optimal human immunodeficiency virus type 1 infection of human peripheral blood cd4 lymphocytes,2010 Jan,2010
19776200,glycoprotein 96 mediated presentation of human immunodeficiency virus type 1 hiv 1 specific human leukocyte antigen class i restricted peptide and humoral immune responses to hiv 1 p24,2009 Nov,2009
19776151,cervical lymphadenitis caused by cryptococcus related immune reconstitutional inflammatory syndrome,2010 Jul,2010
19776131,structure function analysis of human immunodeficiency virus type 1 gp120 amino acid mutations associated with resistance to the ccr5 coreceptor antagonist vicriviroc,2009 Dec,2009
19776130,functional analysis and structural modeling of human apobec3g reveal the role of evolutionarily conserved elements in the inhibition of human immunodeficiency virus type 1 infection and alu transposition,2009 Dec,2009
19776079,inability to access addiction treatment and risk of hiv infection among injection drug users recruited from a supervised injection facility,2010 Sep,2010
19776037,once daily treatment with saquinavir mesylate 2000 mg and ritonavir 100 mg together with a fixed dose combination of abacavir lamivudine 600 300 mg or tenofovir emtricitabine 245 200 mg in hiv 1 infected patients,2009 Dec,2009
19776036,dried blood spots can expand access to virological monitoring of hiv treatment in resource limited settings,2009 Dec,2009
19776001,treatment of anal carcinoma in immune compromised patients,2009 Sep,2009
19775575,budget impact of a set dose combination of efavirenz emtricitabine tenofovir in the treatment of patients infected with hiv 1,2009 Sep-Oct,2009
19775470,prevalence of hiv associated ophthalmic disease among patients enrolling for antiretroviral treatment in india a cross sectional study,2009 Sep 23,2009
19774801,oral manifestations among people living with hiv aids in tanzania,2009 Aug,2009
19740336,impact of human immunodeficiency virus 1 infection and inflammation on the composition and yield of cervical mononuclear cells in the female genital tract,2009 Sep,2009
19774706,concerns grow over cambodia s aids colony,2009 Sep 19,2009
19774694,clinical and virological survey of patients with hepatitis b surface antigen in an italian region clinical considerations and disease burden,2009 Nov,2009
19774685,emergence and diversity of different hiv 1 subtypes in south africa 2000 2001,2009 Nov,2009
19774679,improved detection of jc virus in aids patients with progressive multifocal leukoencephalopathy by t antigen specific fluorescence resonance energy transfer hybridization probe real time pcr evidence of diverse jc virus genotypes associated with progressive multifocal leukoencephalopathy in southern africa,2009 Nov,2009
19774579,dna templated homo and heterodimerization of peptide nucleic acid encoded oligosaccharides that mimick the carbohydrate epitope of hiv,2009,2009
19774206,safety and efficacy of pegylated liposomal doxorubicin in hiv associated kaposi s sarcoma,2009,2009
19773682,pre treatment syphilis titers distribution and evaluation of their use to distinguish early from late latent syphilis and to prioritize contact investigations,2009 Dec,2009
19773664,interobserver concordance in the assessment of liver fibrosis in hiv hcv coinfected patients using transient elastometry,2010 Jul,2010
19773635,gb virus type c infection modulates t cell activation independently of hiv 1 viral load,2009 Nov 13,2009
19773633,kupffer cells are depleted with hiv immunodeficiency and partially recovered with antiretroviral immune reconstitution,2009 Nov 27,2009
19773632,disease progression in hiv 1 infected patients heterozygous for the sickle hemoglobin gene,2009 Nov 13,2009
19773456,hiv epidemics among men who have sex with men in central and eastern europe,2009 Sep,2009
19773294,platelet factor 4 cxcl4 facilitates human macrophage infection with hiv 1 and potentiates virus replication,2009 Dec,2009
19773134,mycobacterium bovis at the animal human interface a problem or not,2010 Jan 27,2010
19772768,review of the occurrence of hemoplasmas hemotrophic mycoplasmas in brazil,2009 Jul-Sep,2009
19772596,haart cell phone adherence trial weltel kenya1 a randomized controlled trial protocol,2009 Sep 22,2009
19772573,incorporating multiple interventions in meta analysis an evaluation of the mixed treatment comparison with the adjusted indirect comparison,2009 Sep 21,2009
19772550,epidemiology and prevention of human papillomavirus and cervical cancer in sub saharan africa a comprehensive review,2009 Oct,2009
19772387,natural history of compensated hepatitis c virus related cirrhosis in hiv infected patients,2009 Oct 15,2009
19771519,differential modulation of mitochondrial oxphos system during hiv 1 induced t cell apoptosis up regulation of complex iv subunit cox ii and its possible implications,2010 Jan,2010
19771504,using electronic drug monitor feedback to improve adherence to antiretroviral therapy among hiv positive patients in china,2010 Jun,2010
19771176,impact of antiretroviral therapy in a cohort of hiv infected patients going in and out of the san francisco county jail,2009 Sep 22,2009
19771168,need for timely paediatric hiv treatment within primary health care in rural south africa,2009 Sep 22,2009
19771133,saliva as a diagnostic medium,2009 Jun,2009
19770804,meta analysis of the incidence of non aids cancers in hiv infected individuals,2009 Dec,2009
19770698,early mortality and cause of deaths in patients using haart in brazil and the united states,2009 Oct 23,2009
19770697,interleukin 10 responses to therapeutic vaccination during highly active antiretroviral therapy and after analytical therapy interruption,2009 Oct 23,2009
19770696,hiv associated pulmonary arterial hypertension survival and prognostic factors in the modern therapeutic era,2010 Jan 2,2010
19770694,effect of hiv infection on adult meningitis in indonesia a prospective cohort study,2009 Nov 13,2009
19770693,evolution and molecular epidemiology of subtype c hiv 1 in zimbabwe,2009 Nov 27,2009
19770692,prevalence of cross reactive hiv 1 neutralizing activity in hiv 1 infected patients with rapid or slow disease progression,2009 Nov 27,2009
19770624,short term ezetimibe is well tolerated and effective in combination with statin therapy to treat elevated ldl cholesterol in hiv infected patients,2009 Oct 23,2009
19770623,foreskin surface area and hiv acquisition in rakai uganda size matters,2009 Oct 23,2009
19770622,tuberculosis among people with hiv infection in the united kingdom opportunities for prevention,2009 Nov 27,2009
19770621,effect of combined antiretroviral therapy on the overall mortality of hiv infected individuals,2010 Jan 2,2010
19769961,toll like receptor and chemokine receptor expression in hiv infected t lymphocyte subsets,2010 Feb,2010
19769834,skin and soft tissue abscess 1 year s experience,2009 Sep-Oct,2009
19769086,preliminary first steps are encouraging gene therapy against hiv interview by waldtraud paukstadt,2009 Apr 30,2009
19769085,how hiv treatment can be simplified once daily as starter therapy is effective,2009 Apr 30,2009
19769084,current data on antiretroviral therapy croi 2009 tenofovir dr convinces by high effectiveness and tolerance,2009 Apr 30,2009
19769076,therapy of hiv hbv coinfection,2009 Apr 30,2009
19769074,treatment of facial lipatrophy,2009 Apr 30,2009
19769073,haart influences the lipids,2009 Apr 30,2009
19769070,epidemiology of the hiv infection,2009 Apr 30,2009
19769069,how to talk about hiv infection,2009 Apr 30,2009
19768553,cns inflammation and macrophage microglial biology associated with hiv 1 infection,2009 Dec,2009
19768243,dietary intake and dyslipidemia arising from combination antiretroviral therapy for hiv infection a systematic review,2009 Jul,2009
19768195,howard university hospital experience with routineized hiv screening a progress report,2009,2009
19767712,periodontal disease and oral hygiene benefits in hiv seropositive and aids patients,2010 Mar 1,2010
19767658,assisted reproductive technologies to establish pregnancies in couples with an hiv 1 infected man,2009 Sep,2009
19767379,significant publications on infectious diseases pharmacotherapy in 2008,2009 Oct 1,2009
19767318,efavirenz a decade of clinical experience in the treatment of hiv,2009 Nov,2009
19767130,antifungal combination therapy in invasive fungal infections,2010 Jan,2010
19767078,efficacy of human c1 esterase inhibitor concentrate compared with placebo in acute hereditary angioedema attacks,2009 Oct,2009
19766928,truths and myths that influence the sexual decision making process among young multiethnic college women,2009 Oct,2009
19766208,maternal and perinatal outcomes of visceral leishmaniasis kala azar treated with sodium stibogluconate in eastern sudan,2009 Dec,2009
19766153,hiv 1 derived peptides fused to hbsag affect its immunogenicity,2009 Dec,2009
19766126,effect of intrinsic stochasticity on transmitted hiv drug resistance patterns,2010 Jan 7,2010
19766083,regulatory t cells reinforce intestinal homeostasis,2009 Sep 18,2009
19765997,bacteriophages as model organisms for virus emergence research,2009 Oct,2009
19765935,visual dna microarrays for simultaneous detection of human immunodeficiency virus type 1 and treponema pallidum coupled with multiplex asymmetric polymerase chain reaction,2009 Dec,2009
19765879,degrees of disclosure a study of women s covert use of the diaphragm in an hiv prevention trial in sub saharan africa,2009 Nov,2009
19765788,performance of a prototype malaria rapid diagnostic test versus thick film microscopy among hiv positive subjects in rural rakai uganda,2010 Mar,2010
19765517,filling a gap in transfusion medicine education and research,2009 Oct,2009
19765313,perinatal acquisition of drug resistant hiv 1 infection mechanisms and long term outcome,2009 Sep 19,2009
19765310,intestinal parasitic infections in relation to hiv aids status diarrhea and cd4 t cell count,2009 Sep 18,2009
19765291,tuberculosis recurrence in smear positive patients cured under dots in southern ethiopia retrospective cohort study,2009 Sep 18,2009
19765271,brazilian network for hiv drug resistance surveillance a survey of individuals recently diagnosed with hiv,2009 Sep 18,2009
19764885,molecular epidemiology of mycobacterium tuberculosis in a south african community with high hiv prevalence,2009 Oct 15,2009
19764661,prevalence of hiv seropositivity in patients with lymphoid malignancies in a tertiary centre in southern nigeria,2009 Jun,2009
19764656,prevalence of human immunodeficiency virus in ophthalmic surgical patients,2009 Jun,2009
19763976,chemokine receptor signaling and hiv infection,2009,2009
19763967,chemokine receptor dimerization and chemotaxis,2009,2009
19763813,comparing couples and individual voluntary counseling and testing for hiv at antenatal clinics in tanzania a randomized trial,2010 Jun,2010
19763812,risk behaviors and psychosocial stressors in the new york city house ball community a comparison of men and transgender women who have sex with men,2010 Apr,2010
19763811,factors associated with parent child communication about hiv aids in the united states and kenya a cross cultural comparison,2010 Oct,2010
19763810,psychosocial characteristics and sexual behaviors of people in care for hiv infection an examination of men who have sex with men heterosexual men and women,2009 Dec,2009
19763273,cat and mouse of hiv 1 antibody escape,2009 Sep,2009
19763271,limited neutralizing antibody specificities drive neutralization escape in early hiv 1 subtype c infection,2009 Sep,2009
19763269,escape from autologous neutralizing antibodies in acute early subtype c hiv 1 infection requires multiple pathways,2009 Sep,2009
19763181,early steps of hiv 1 fusion define the sensitivity to inhibitory peptides that block 6 helix bundle formation,2009 Sep,2009
19762962,comparison of a dna based pcr method with conventional methods for the detection of m tuberculosis in jos nigeria,2009 Jul 1,2009
19762785,acipimox an inhibitor of lipolysis attenuates atherogenesis in ldlr null mice treated with hiv protease inhibitor ritonavir,2009 Dec,2009
19762676,efficacy of hiv sti behavioral interventions for african american females in the united states a meta analysis,2009 Nov,2009
19762674,risk assessment and screening for sexually transmitted infections hiv and hepatitis virus among long distance truck drivers in new mexico 2004 2006,2009 Nov,2009
19762673,social environmental factors and protective sexual behavior among sex workers the encontros intervention in brazil,2010 Apr 1,2010
19762670,std prevalence risky sexual behaviors and sex with women in a national sample of chinese men who have sex with men,2009 Nov,2009
19762666,enhancing cultural and contextual intervention strategies to reduce hiv aids among african americans,2009 Nov,2009
19762662,pregnancy as a window of opportunity for hiv prevention effects of an hiv intervention delivered within prenatal care,2009 Nov,2009
19762650,simplifying consent increases hiv testing and new case detection the san francisco experience,2009 Nov,2009
19762505,reduced intensity conditioning allogeneic stem cell transplantation in hiv patients with hematologic malignancies yes we can,2009 Sep 17,2009
19762250,awake video assisted pleural decortication for empyema thoracis,2010 Mar,2010
19762032,development and validation of a normal phase high performance thin layer chromatographic method for the analysis of sulfamethoxazole and trimethoprim in co trimoxazole tablets,2009 Oct 16,2009
19761705,relationship between chinese construction workers hiv aids related knowledge attitudes and behaviour a structural equation model,2009 Jul-Aug,2009
19761622,characterizing trends in hiv infection among men who have sex with men in australia by birth cohorts results from a modified back projection method,2009 Sep 18,2009
19761402,differential inhibition of homotrimeric dutpases by the 3 azido derivative of dideoxy utp,2010 Feb,2010
19761079,living on the extreme margin social exclusion of the transgender population hijra in bangladesh,2009 Aug,2009
19761017,constraints in nurses use of hiv protective barriers in the care of plwha in the university college hospital ibadan nigeria,2009,2009
19760051,validation of the edinburgh postnatal depression scale among women in a high hiv prevalence area in urban zimbabwe,2010 Jun,2010
19760050,risk behaviors for hcv and hiv seroprevalence among female crack users in porto alegre brazil,2010 Jun,2010
19760048,depression in women living with hiv clinical and psychosocial correlates,2010 Jun,2010
19759892,novel liposome based adjuvant caf01 for induction of cd8 cytotoxic t lymphocytes ctl to hiv 1 minimal ctl peptides in hla a 0201 transgenic mice,2009 Sep 11,2009
19759880,quality of life among hiv infected patients in brazil after initiation of treatment,2009,2009
19759879,crack cocaine use and its relationship with violence and hiv,2009,2009
19759565,vaccine that delivers rather than induces antibodies,2009 Nov,2009
19759518,inability to disrupt the immunological synapse between infected human t cells and apcs distinguishes hiv 1 from most other primate lentiviruses,2009 Oct,2009
19759513,bilateral pedal edema in an hiv patient lopinavir ritonavir containing treatment regimen as a potential cause,2009 Jun 1,2009
19759509,prevalence of resistance associated mutations to protease and reverse transcriptase inhibitors in treatment na ve hiv1 infected individuals in casablanca morocco,2009 Jun 1,2009
19759497,dual infection with dengue virus 3 and human immunodeficiency virus 1 in havana cuba,2009 May 1,2009
19759481,detection of hepatitis c virus and human immunodeficiency virus in expatriates in saudi arabia by antigen antibody combination assays,2009 Apr 30,2009
19759256,comparison of 3 drug versus 4 drug and pi versus non pi combinations as initial haart experience from 1998 to 2007,2009 Sep-Oct,2009
19759255,hiv infected thais need help to adjust to a normal life in society,2009 Sep-Oct,2009
19759232,clinical and resistance consequences of misquantification of plasma and cerebrospinal fluid human immunodeficiency virus type 1 hiv 1 rna in samples from an hiv 1 subtype g infected patient,2009 Nov,2009
19759213,multiplex primer prediction software for divergent targets,2009 Oct,2009
19759152,loss of raltegravir susceptibility by human immunodeficiency virus type 1 is conferred via multiple nonoverlapping genetic pathways,2009 Nov,2009
19759140,clade specific evolution mediated by hla b 57 5801 in human immunodeficiency virus type 1 clade a1 p24,2009 Dec,2009
19759136,cdk inhibitor p21cip1 waf1 is induced by fcgammar activation and restricts the replication of human immunodeficiency virus type 1 and related primate lentiviruses in human macrophages,2009 Dec,2009
19759127,maribavir inhibits epstein barr virus transcription in addition to viral dna replication,2009 Dec,2009
19759047,evolution of an integrated sexual health service,2009 Oct,2009
19758480,food consumption and nutritional status of people living with hiv aids plwha a case of thika and bungoma districts kenya,2010 Apr,2010
19758442,human cellular restriction factors that target hiv 1 replication,2009 Sep 16,2009
19758384,dermatological aspects of medicine highly active antiretroviral therapy and the treatment of human immunodeficiency virus,2010 Jan,2010
19758099,3 4 methylenedioxymethamphetamine increases susceptibility to genital herpes simplex virus infection in mice,2009 Oct 15,2009
19758095,effect of a point of use water treatment and safe water storage intervention on diarrhea in infants of hiv infected mothers,2009 Oct 15,2009
19757993,switch from enfuvirtide to raltegravir in virologically suppressed multidrug resistant hiv 1 infected patients a randomized open label trial,2009 Oct 15,2009
19757815,synthesis biological evaluation and structure activity relationships for 5 e 2 arylethenyl 3 isoxazolecarboxylic acid alkyl ester derivatives as valuable antitubercular chemotypes,2009 Oct 22,2009
19757300,limited prognostic value of the international prognostic score in advanced stage human immunodeficiency virus infection related hodgkin lymphoma treated with the doxorubicin bleomycin vinblastine and dacarbazine regimen,2009 Oct,2009
19757019,reducing hiv risks among active injection drug and crack users the safety counts program,2010 Jun,2010
19757018,acceptability and use of the diaphragm and replens lubricant gel for hiv prevention in southern africa,2010 Jun,2010
19757017,acceptability of uc781 gel as a rectal microbicide among hiv uninfected women and men,2010 Jun,2010
19757011,sexual behaviors among club drug users prevalence and reliability,2010 Dec,2010
19756920,hhv8 positive hiv negative multicentric castleman s disease early and sustained complete remission with rituximab therapy without reactivation of kaposi sarcoma,2009 Oct,2009
19756611,diagnostic and therapy of salivary gland diseases relevant aspects for the pathologist from the clinical perspective,2009 Nov,2009
19756299,understanding apoptosis by systems biology approaches,2009 Oct,2009
