UID,Title,PublicationDate,PublicationYear
19338781,prolyl isomerase pin1 stabilizes the human t cell leukemia virus type 1 htlv 1 tax oncoprotein and promotes malignant transformation,2009 Apr 3,2009
19338734,sex education and knowledge of venerial disease among public school 9th graders,2009 Mar 30,2009
19338514,anti tb drug resistance levels and patterns among mycobacterium tuberculosis isolated from newly diagnosed cases of pulmonary tuberculosis in dar es salaam tanzania,2009 Apr,2009
19338474,identification of nevirapine resistant hiv 1 in the latent reservoir after single dose nevirapine to prevent mother to child transmission of hiv 1,2009 May 1,2009
19338473,establishment of drug resistant hiv 1 in latent reservoirs,2009 May 1,2009
19338244,epidemic process of gonorrhea in modern world,2009 Jan-Feb,2009
19338231,counteraction to hiv aids epidemic in eastern europe and central asia,2009 Jan-Feb,2009
19338141,single dose randomized open label two period crossover bioequivalence study comparing a fixed dose pediatric combination of lamivudine and stavudine tablet for oral suspension with individual liquid formulations in healthy adult male volunteers,2009,2009
19307351,hiv and other sexually transmitted infections among men transgenders and women selling sex in two cities in pakistan a cross sectional prevalence survey,2009 Apr,2009
19307347,modelling the transmission of hiv and hcv among injecting drug users in rawalpindi a low hcv prevalence setting in pakistan,2009 Apr,2009
19307346,prevalence of hiv hcv and sexually transmitted infections among injecting drug users in rawalpindi and abbottabad pakistan evidence for an emerging injection related hiv epidemic,2009 Apr,2009
19307345,stis and hiv in pakistan from analysis to action,2009 Apr,2009
19307341,age at first sex in rural south africa,2009 Apr,2009
19307338,is sexual risk taking behaviour changing in rural south west uganda behaviour trends in a rural population cohort 1993 2006,2009 Apr,2009
19338073,recurrent increase of liver enzymes in a human immunodeficiency virus infected male with recent acute hepatitis b infection,2009 Apr,2009
19338072,current role of tenofovir in clinical medicine,2008 Jun,2008
19338050,malnutrition and neutropenia in children treated for burkitt lymphoma in malawi,2009 Jul,2009
19337935,young parents relationship characteristics shared sexual behaviors perception of partner risks and dyadic influences,2009 Sep-Oct,2009
19337934,race based sexual stereotyping and sexual partnering among men who use the internet to identify other men for bareback sex,2009 Sep-Oct,2009
19337730,mhc haplotype h6 is associated with sustained control of sivmac251 infection in mauritian cynomolgus macaques,2009 May,2009
19337434,once daily fosamprenavir with ritonavir in the treatment of hiv infection in therapy na ve patients,2008 Dec,2008
19337023,growth and puberty in children with hiv infection,2009 Jan,2009
19336831,maraviroc a coreceptor ccr5 antagonist for management of hiv infection,2009 Apr 15,2009
19336755,hodgkin lymphoma in the swiss hiv cohort study,2009 Jun 4,2009
19336735,cd4 counts and the risk of systemic non hodgkin s lymphoma in individuals with hiv in the uk,2009 Jun,2009
19336585,isolation of a cellular factor that can reactivate latent hiv 1 without t cell activation,2009 Apr 14,2009
19336438,cohort profile mamanengane or the africa centre vertical transmission study,2010 Apr,2010
19335951,comparison of four culture systems for mycobacterium tuberculosis in the zambian national reference laboratory,2009 Apr,2009
19335922,seroprevalence and factors associated with herpes simplex virus type 2 among hiv negative high risk men who have sex with men from rio de janeiro brazil a cross sectional study,2009 Apr 1,2009
19335728,vaccines under study non hiv vaccines,2009 Mar-Apr,2009
19335727,hiv vaccines under study,2009 Mar-Apr,2009
19335673,perceived knowledge of blood borne pathogens and avoidance of contact with infected patients,2009 Mar,2009
19335659,emerging role of supervised injecting facilities in human immunodeficiency virus prevention,2009 Apr,2009
19335601,need for syphilis screening and counselling in hiv counselling and testing centres a curtain raiser study from north india,2009 Apr,2009
19335468,effectiveness of a non surgical alternative to the mules operation in sheep,2009 Apr,2009
19335172,willingness to be circumcised for preventing hiv among chinese men who have sex with men,2009 May,2009
19335171,missed opportunities for religious organizations to support people living with hiv aids findings from tanzania,2009 May,2009
19334477,predictive value of detection of hiv p24 antigen in the use of test systems with increased analytical sensitivity,2009 Feb,2009
19334395,cutaneous infection caused by alternaria alternata in an immunocompetent host,2009 Jan,2009
19334331,who s idea for universal hiv testing raises hopes and fears,2009 Mar,2009
19334327,images in hiv aids fatal progressive multifocal leukoencephalopathy still a problem in the era of highly active antiretroviral therapy,2009 Mar,2009
19334326,hiv positive surgeon an evidence based approach,2009 Mar,2009
19334325,policy watch science and policy a perpetual dilemma,2009 Mar,2009
19334324,battle against virus shows signs of progress,2009 Mar,2009
27269644,mapping the body tracing the personal and the political dimensions of hiv aids in khayelitsha south africa,2009 Apr 1,2009
25580473,enhancing patient adherence promoting engagement via positive patient provider relationships in hiv aids care,2009 Spring,2009
24204104,challenges of ensuring participant consent in internet based sex studies a case study of the men s internet sex mints i and ii studies,2009 Apr,2009
23946544,support groups marriage and the management of ambiguity among hiv positive women in northern nigeria,2009 Spring,2009
23282982,specific immunotherapy in a pollen allergic patient with human immunodeficiency virus infection,2009 Apr,2009
23227032,role of the charged residues of the gp2 helical regions in ebola entry,2009 Apr,2009
22649588,life and death decisions in the cd95 system main pro and anti apoptotic modulators,2009 Apr,2009
22495475,from chemotherapy to signal therapy 1909 2009 a century pioneered by paul ehrlich,2009 Apr,2009
22199461,arv treatment and time allocation to household tasks evidence from kenya,2009 Apr 1,2009
21976786,semiparametric inference of proportional odds model based on randomly truncated data,2009 Apr 1,2009
21789050,use of nomograms for predictions of outcome in patients with advanced bladder cancer,2009 Apr,2009
20827388,analyzing direct effects in randomized trials with secondary interventions an application to hiv prevention trials,2009 Apr,2009
20669399,birds the bees and the bible single african american mothers perceptions of a faith based sexuality educaton program,2009 Spring,2009
20524488,prevalence of hiv in pregnant women identified with a risk factor at a tertiary care hospital,2009 Apr-Jun,2009
20524456,treatment of hbv and hdv co infection using lamivudine,2009 Apr-Jun,2009
20509336,inoculation leprosy and hiv co infection a rare case with nerve involvement preceding development of skin patch and type 1 reaction as immune reconstitution syndrome following antiretroviral therapy,2009 Apr-Jun,2009
19334060,declined neural efficiency in cognitively stable human immunodeficiency virus patients,2009 Mar,2009
19333805,changing global essential medicines norms to improve access to aids treatment lessons from brazil,2009,2009
19333559,generation and application of polyclonal antibody against replication and transcription activator of kaposi s sarcoma associated herpesvirus,2010 Feb,2010
19333441,molecular neuropathology of gliomas,2009 Jan,2009
19333387,comparison of replication competent first generation and helper dependent adenoviral vaccines,2009,2009
19333054,sexually transmitted infections as a cause of proctitis in men who have sex with men,2009 Mar,2009
19332968,risk factors for mortality from primary cryptococcosis in patients with hiv,2009 Mar,2009
19332911,sexually transmitted infections and reproductive tract infections in female sex workers,2009 Apr-Jun,2009
19332801,scaleable manufacture of hiv 1 entry inhibitor griffithsin and validation of its safety and efficacy as a topical microbicide component,2009 Apr 14,2009
19332732,autologous stem cell transplantation in patients with hiv related lymphoma,2009 May 1,2009
19332587,ethics surrounding hiv kidney donation and patient confidentiality,2009 Apr,2009
19332396,lc tandem ms assay for the simultaneous measurement of new antiretroviral agents raltegravir maraviroc darunavir and etravirine,2009 Apr 15,2009
19331682,economic costs and health related quality of life of people with hiv aids in the canary islands spain,2009 Mar 30,2009
19331279,helping to heal a broken life,2009 Jan-Feb,2009
19331259,sangomas problem or solution for south africa s health care system,2009 Mar,2009
19330805,doxycycline enhances the ras mapk signaling and proliferation of mouse thymic epithelial cells,2009 Jun 1,2009
19330539,molecular modification of t4 bacteriophage proteins and its potential application review,2009,2009
19330443,systematic review of factors influencing fertility desires and intentions among people living with hiv aids implications for policy and service delivery,2009 Oct,2009
19330442,exploratory behavioral intervention trial to improve rates of screening for aids clinical trials among racial ethnic minority and female persons living with hiv aids,2010 Jun,2010
19330436,methamphetamine and viagra use relationship to sexual risk behaviors,2011 Apr,2011
19329775,is there a role for decision aids in advanced breast cancer,2009 Jul-Aug,2009
19329448,treatment of intestinal protozoan infections in children,2009 Jun,2009
19329355,resistance to antiretrovirals in hiv infected pregnant women,2009 May,2009
19329290,compliance to antiretroviral treatment in children in brazzaville congo,2009 May,2009
19329176,sustainability of gains made in a primary school hiv prevention programme in kenya into the secondary school years,2010 Aug,2010
19328999,universal voluntary hiv testing and immediate antiretroviral therapy,2009 Mar 28,2009
19328996,universal voluntary hiv testing and immediate antiretroviral therapy,2009 Mar 28,2009
19328995,universal voluntary hiv testing and immediate antiretroviral therapy,2009 Mar 28,2009
19328994,universal voluntary hiv testing and immediate antiretroviral therapy,2009 Mar 28,2009
19328992,universal voluntary hiv testing and immediate antiretroviral therapy,2009 Mar 28,2009
19328850,development of a long acting injectable formulation with nanoparticles of rilpivirine tmc278 for hiv treatment,2009 Aug,2009
19328734,safe substitution to zidovudine among hiv infected patients initiated on stavudine containing highly active antiretroviral therapy from a resource limited setting,2009 Nov,2009
19328555,markers and risk factors for hcv hbv and hiv in a network of injecting drug users in melbourne australia,2009 May,2009
19328477,first report of the absence of viral load in testicular sperm samples obtained from men with hepatitis c and hiv after washing and their subsequent use,2009 Sep,2009
19328024,outcome after injections of crushed tablets in intravenous drug abusers in the helsinki university central hospital,2009 Jun,2009
19327917,factors associated with event level stimulant use during sex in a sample of older low income men who have sex with men in los angeles,2009 Jun 1,2009
19327806,intestinal parasitic infections in hiv aids patients presenting with diarrhoea in jakarta indonesia,2009 Sep,2009
19327647,mosquito borne diseases,2009 Apr,2009
19327512,patient outcome after aortic valve replacement with a mechanical or biological prosthesis weighing lifetime anticoagulant related event risk against reoperation risk,2009 Apr,2009
19327355,requirement for microtubule integrity in the socs1 mediated intracellular dynamics of hiv 1 gag,2009 Apr 17,2009
19327341,role of amphibian antimicrobial peptides in protection of amphibians from pathogens linked to global amphibian declines,2009 Aug,2009
19327166,cancer risk in persons with hiv aids in india a review and future directions for research,2009 Mar 28,2009
19327116,ccaat enhancer binding proteins and the pathogenesis of retrovirus infection,2009 Apr,2009
19327099,community support and disclosure of hiv serostatus to family members by public sector antiretroviral treatment patients in the free state province of south africa,2009 May,2009
19327055,identification of a new hiv type 1 circulating recombinant form crf38 bf1 in uruguay,2009 Mar,2009
19327052,changing trend of hiv type 1 subtypes in nairobi,2009 Mar,2009
19327051,differential regulation of indoleamine 2 3 dioxygenase ido by hiv type 1 clade b and c tat protein,2009 Mar,2009
19327050,robust supervised and unsupervised statistical learning for hiv type 1 coreceptor usage analysis,2009 Mar,2009
19327048,single nef proteins from hiv type 1 subtypes c and f fail to upregulate invariant chain cell surface expression but are active for other functions,2009 Mar,2009
19327028,past present and future of hiv prevention integrating behavioral biomedical and structural intervention strategies for the next generation of hiv prevention,2009,2009
19327023,long term hiv 1 suppression in the brazilian public health system,2009 May,2009
19326997,changes in nk cell counts and receptor expressions and emergence of cd3 dim cd56 cells in hiv 1 infected patients in china,2009 Apr,2009
19245929,therapeutic strategies for hepatitis and other infection related immune thrombocytopenias,2009 Jan,2009
19326281,structural barriers and human rights related to hiv prevention and treatment in zimbabwe,2009,2009
19326264,ideologies of sexuality menstruation and risk girls experiences of puberty and schooling in northern tanzania,2009 May,2009
19326208,changing drug users risk environments peer health advocates as multi level community change agents,2009 Jun,2009
19326206,pmtct haart and childbearing in mozambique an institutional perspective,2009 Jun,2009
19325916,is ppar a prospective player in hiv 1 associated bone disease,2009,2009
19325707,hiv prevalence risks for hiv infection and human rights among men who have sex with men msm in malawi namibia and botswana,2009,2009
19325703,hiv aspartyl peptidase inhibitors interfere with cellular proliferation ultrastructure and macrophage infection of leishmania amazonensis,2009,2009
19325571,pneumocystis choroiditis,2010 Jan,2010
19325495,comparison of hiv prevalence estimates from sentinel surveillance and a national population based survey in uganda 2004 2005,2009 May 1,2009
19325119,quantitative 3d video microscopy of hiv transfer across t cell virological synapses,2009 Mar 27,2009
19325090,biomedical research hughes backs institute at epicenter of hiv and resistant tb,2009 Mar 27,2009
19324581,acute encephalopathy and multi organ involvement with rhabdomyolysis during primary hiv infection,2009 Sep,2009
19324460,delay in the diagnosis of hiv infection in spain can we tackle this epidemic in primary care,2009 Apr,2009
19324415,hiv post exposure prophylaxis in children and adolescents presenting for reported sexual assault,2009 Mar,2009
19324287,hiv and homosexuality in pakistan,2009 Apr,2009
19323863,mothers infant feeding experiences constraints and supports for optimal feeding in an hiv impacted urban community in south africa,2009 Nov,2009
19323807,what do young adults know about the hiv aids epidemic findings from a population based study in karachi pakistan,2009 Mar 26,2009
19323719,update on hiv and infant feeding issues in developed and developing countries,2009 Mar-Apr,2009
19323606,efficacy and acceptability of rapid point of care hiv testing in two clinical settings in ghana,2009 May,2009
19323561,harnessing nature s insight design of aspartyl protease inhibitors from treatment of drug resistant hiv to alzheimer s disease,2009 Apr 23,2009
19323062,recommendations of an expert group appointed by the polish gynaecological society on prevention of mother to child transmission of hiv,2009 Jan,2009
19323059,pathogenesis and risk of hiv infection in women review of recent literature,2009 Jan,2009
19323042,tuberculosis co morbidity and perceptions about health care among hiv infected plasma donors in rural china,2009 Jan,2009
19323041,anti tuberculosis drug resistance and hiv co infection in phnom penh cambodia,2009 Jan,2009
19323040,characteristics of hiv infected tuberculosis patients in thailand,2009 Jan,2009
19323039,impact of a public antiretroviral program on tb hiv mortality banteay meanchey cambodia,2009 Jan,2009
19323038,hiv 1 drug resistance mutations in children who failed non nucleoside reverse transcriptase inhibitor based antiretroviral therapy,2009 Jan,2009
19323037,demographic socio economic behavioral and clinical factors predicting virologic failure with generic fixed dose combination antiretroviral therapy before universal health insurance coverage in northern thailand,2009 Jan,2009
19323036,seroprevalence of hiv and hepatitis c co infection among blood donors in kathmandu valley nepal,2009 Jan,2009
19323012,prime boost vaccination using recombinant mycobacterium bovis bcg and recombinant vaccinia virus dis harboring hiv 1 crf01 ae gag in mice influence of immunization routes,2009 Mar,2009
19323011,prevalence of hiv infection and predictors for syphilis infection among female sex workers in southern china,2009 Mar,2009
19323005,high prevalence of microsporidium infection in hiv infected patients,2009 Mar,2009
19322966,insights into immunopathogenic mechanisms of hiv infection high levels of immune activation and hiv fitness,2008 Nov,2008
19322955,hiv and community acquired mrsa,2009 Mar,2009
19322744,effect of rosiglitazone on insulin sensitivity beta cell function bone mineral density and body composition in hiv positive patients on highly active antiretroviral therapy haart,2009 Jul,2009
19322704,no evidence of hiv pol gene in spinal cord tissues in sporadic als by real time rt pcr,2010,2010
19322667,adherence to the mediterranean diet is associated with a lower risk of body shape changes in croatian patients treated with combination antiretroviral therapy,2009,2009
19322555,highly active antiretroviral therapy of neuro aids side effects on the nervous system and interactions,2009 Oct,2009
19322041,association between male circumcision and prevalent hiv infections in rio de janeiro brazil,2009 Apr 1,2009
19322040,using mathematical modeling to bridge phase 3 microbicide trials with public health decision making,2009 Apr 1,2009
19321884,dynamic model of client recruitment and retention in community based hiv prevention programs,2011 Jan,2011
19321868,male circumcision for the prevention of hsv 2 and hpv infections and syphilis,2009 Mar 26,2009
19321756,genetic and temporal dynamics of human immunodeficiency virus type 1 crf07 bc in xinjiang china,2009 Jul,2009
19321732,dried plasma transport using a novel matrix and collection system for human immunodeficiency virus and hepatitis c virus virologic testing,2009 May,2009
19321618,tissue specific sequence alterations in the human immunodeficiency virus type 1 envelope favoring ccr5 usage contribute to persistence of dual tropic virus in the brain,2009 Jun,2009
19321617,improved survival in rhesus macaques immunized with modified vaccinia virus ankara recombinants expressing simian immunodeficiency virus envelope correlates with reduction in memory cd4 t cell loss and higher titers of neutralizing antibody,2009 Jun,2009
19321612,comparison of human and rhesus macaque t cell responses elicited by boosting with nyvac encoding human immunodeficiency virus type 1 clade c immunogens,2009 Jun,2009
19321586,provision of multiple rather than two or fewer micronutrients more effectively improves growth and other outcomes in micronutrient deficient children and adults,2009 May,2009
19321545,pope claims that condoms exacerbate hiv and aids problem,2009 Mar 25,2009
19321516,web resources for rare auto inflammatory diseases towards a common patient registry,2009 Jun,2009
19321503,mitochondrial function morphology and metabolic parameters improve after switching from stavudine to a tenofovir containing regimen,2009 Jun,2009
19321342,vacuum cushioned removable cast walkers reduce foot loading in patients with diabetes mellitus,2009 Jul,2009
19320868,quantitative estimate of the risks and benefits of possible alternative blood donor deferral strategies for men who have had sex with men,2009 Jun,2009
19320697,it ain t what you do it s the way that you do it a qualitative study of advice for young cannabis users,2009 Mar,2009
19320602,first detection of a novel hiv type 1 crf01 ae 07 bc recombinant among an epidemiologically linked cohort of idus in jiangsu china,2009 Apr,2009
19320601,darunavir concentrations in cerebrospinal fluid and blood in hiv 1 infected individuals,2009 Apr,2009
19320599,characterizing social support global and specific social support experiences of hiv infected youth,2009 May,2009
19320592,low levels of antiretroviral resistant hiv infection in a routine clinic in cameroon that uses the world health organization who public health approach to monitor antiretroviral treatment and adequacy with the who recommendation for second line treatment,2009 May 1,2009
19320571,lack of a decline in hiv incidence in a rural community with high hiv prevalence in south africa 2003 2007,2009 Apr,2009
19320570,comparison of once daily fosamprenavir boosted with either 100 or 200 mg of ritonavir in combination with abacavir lamivudine 96 week results from col100758,2009 Apr,2009
19320569,four year safety with polyacrylamide hydrogel to correct antiretroviral related facial lipoatrophy,2009 Apr,2009
19320568,dendritic cell differentiation and maturation in the presence of hiv type 2 envelope,2009 Apr,2009
19320567,high hiv type 1 prevalence and wide genetic diversity with dominance of recombinant strains but low level of antiretroviral drug resistance mutations in untreated patients in northeast gabon central africa,2009 Apr,2009
19320566,liver complications have reached a plateau as cause of hospital admission and death in hiv patients in madrid,2009 Apr,2009
19320565,worldwide distribution of hiv type 1 epitopes recognized by human anti v3 monoclonal antibodies,2009 Apr,2009
19320564,frequent gross deletion in the hiv type 1 nef gene in hemophiliacs treated with korean red ginseng inhibition of detection by highly active antiretroviral therapy,2009 Apr,2009
19320554,efficient generation of dopamine neuron like cells from skin derived precursors with a synthetic peptide derived from von hippel lindau protein,2009 Dec,2009
19320423,is condom use the answer to preventing hiv transmission through sexual intercourse,2008 Dec,2008
19320404,attitude and practice of antenatal hiv screening among pregnant women attending a secondary health facility in benin city,2008 Dec,2008
19320371,assessing mediation in hiv intervention studies,2009 Mar-Apr,2009
19320366,club drug use and dependence among young adults recruited through time space sampling,2009 Mar-Apr,2009
19320245,perinatal zidovudine prophylaxis in hiv type 1 infected pregnant women with thalassaemia carriage in thailand,2009,2009
19320244,phase i study to explore the activity and safety of sch532706 a small molecule chemokine receptor 5 antagonist in hiv type 1 infected patients,2009,2009
19320243,compilation and prevalence of mutations associated with resistance to non nucleoside reverse transcriptase inhibitors,2009,2009
19320242,are mutations in hiv type 1 reverse transcriptase 245 codon predictive of abacavir hypersensitivity reaction,2009,2009
19320240,body image is a major determinant of sexual dysfunction in stable hiv infected women,2009,2009
19320239,absence of a relation between efavirenz plasma concentrations and toxicity driven efavirenz discontinuations in the eurosida study,2009,2009
19320238,mortality and morbidity among hiv type 1 infected patients during the first 5 years of a multicountry hiv workplace programme in africa,2009,2009
19319955,plasma hhv 8 viral load in hhv 8 related lymphoproliferative disorders associated with hiv infection,2009 May,2009
19319917,posttraumatic stress in aids orphaned children exposed to high levels of trauma the protective role of perceived social support,2009 Apr,2009
19319674,hiv infection among internally displaced women and women residing in river populations along the congo river democratic republic of congo,2009 Oct,2009
19319448,evaluation of hematological virologic and anthropometric parameters as progression markers in hiv 1 infected children,2009 Mar-Apr,2009
19319446,diversity and prevalence of antiretroviral genotypic resistance mutations among hiv 1 infected children,2009 Mar-Apr,2009
19319199,nonadherence to primary prophylaxis against pneumocystis jirovecii pneumonia,2009,2009
19319142,b cells in hiv infection and disease,2009 Apr,2009
19318998,impact of integrated hiv care on patient health outcomes,2009 May,2009
19318931,preeclampsia and anaesthesia,2009 Jun,2009
19318909,targeted testing for acute hiv infection in north carolina,2009 Apr 27,2009
19318907,association of hiv viral load with monocyte chemoattractant protein 1 and atherosclerosis burden measured by magnetic resonance imaging,2009 May 15,2009
19318676,performance of tests for latent tuberculosis in different groups of immunocompromised patients,2009 Jul,2009
19318615,effect of highly active antiretroviral therapy on incident aids using calendar period as an instrumental variable,2009 May 1,2009
19318348,extensively drug resistant tuberculosis in the uk 1995 to 2007,2009 Jun,2009
19318095,detection of toxoplasma gondii in cerebrospinal fluid from aids patients by nested pcr and rapid identification of type i allele at b1 gene by rflp analysis,2009 Jul,2009
