UID,Title,PublicationDate,PublicationYear
19547873,effectiveness and safety of isoniazid chemoprophylaxis for hiv 1 infected patients from rio de janeiro,2009 May,2009
19547794,adolescents knowledge about sexuality before and after participating in prevention workshops,2009 May-Jun,2009
19547757,pilot study of essential drug quality in two major cities in india,2009 Jun 23,2009
19547711,reliability at the lower limits of hiv 1 rna quantification in clinical samples a comparison of rt pcr versus bdna assays,2009 Jun 23,2009
19546813,time trends and regional differences in the prevalence of hiv infection among women attending antenatal clinics in 2 provinces in cameroon,2009 Oct 1,2009
19546811,maraviroc concentrates in the cervicovaginal fluid and vaginal tissue of hiv negative women,2009 Aug 15,2009
19546637,street nursing,2009 Jul,2009
19546414,cutaneous malignancies among hiv infected persons,2009 Jun 22,2009
19546363,potent activity of a nucleoside reverse transcriptase inhibitor 4 ethynyl 2 fluoro 2 deoxyadenosine against human immunodeficiency virus type 1 infection in a model using human peripheral blood mononuclear cell transplanted nod scid janus kinase 3 knockout mice,2009 Sep,2009
19546353,increased engraftment of hepatic progenitors after activation of the hepatocyte growth factor signaling pathway by protein transduction,2009 Sep,2009
19546238,identification and profiling of circulating metabolites of atazanavir a hiv protease inhibitor,2009 Sep,2009
19546119,use of focus groups to develop methods to communicate cardiovascular disease risk and potential for risk reduction to people with type 2 diabetes,2009 Oct,2009
19546027,risk of a second diagnostic window with 4th generation hiv assays two cases,2009 Aug,2009
19545935,serotype replacement in perspective,2009 Aug 21,2009
19545503,newer antiretroviral agents and how to use them,2009 Jul,2009
19545502,prevention counseling for hiv infected persons what every clinician needs to know,2009 Jul,2009
19545501,antiretroviral therapy for treatment na ve patients a review of recent literature and the updated guidelines,2009 Jul,2009
19545469,nutrition and health education intervention for student volunteers topic wise assessment of impact using a non parametric test,2010 Jan,2010
19545433,serum lipid profiles among patients initiating ritonavir boosted atazanavir versus efavirenz based regimens,2009 Jun 22,2009
19545209,adult male circumcision does not reduce the risk of incident neisseria gonorrhoeae chlamydia trachomatis or trichomonas vaginalis infection results from a randomized controlled trial in kenya,2009 Aug 1,2009
19545045,will climate and demography have a major impact on malaria in sub saharan africa in the next 20 years,2009 Apr,2009
19544984,health promotion in sexual health 2 how to put theory into practice and empower clients,2009 May 19-25,2009
19544698,eradicating malaria,2009,2009
19544612,swine origin influenza a h1n1 and hiv the cdc offers guidance for hiv infected patients potentially exposed to swine flu,2009 Jun,2009
19544611,2009 h1n1 swine flu anatomy of an outbreak,2009 Jun,2009
19544610,cdc launches new aids awareness campaign,2009 Jun,2009
19544608,fda notifications eua issued for treating novel 2009 h1n1 flu,2009 Jun,2009
19544607,hiv prevention trials require sophisticated community preparation controversial prep trials serve as cautionary tale,2009 Jun,2009
19544605,recent flu vaccine and hiv trial holds promising news hiv patients could quickly safely enroll,2009 Jun,2009
19544604,hiv clinicians and patients should prepare now for fall pandemic flu recent novel h1n1 flu outbreak offers lessons,2009 Jun,2009
19544594,seroprevalence of htlv 1 2 infection among native and immigrant pregnant women in spain,2009 Jun,2009
19544540,current state of brachytherapy nomograms for patients with clinically localized prostate cancer,2009 Jul 1,2009
19544492,chiral analysis of anti acquired immunodeficiency syndrome drug 9 r 2 phosphonomethoxy propyl adenine tenofovir and related antiviral acyclic nucleoside phosphonates by ce using beta cd as chiral selector,2009 Jun,2009
19544131,social context of sexual health and sexual risk for urban adolescent girls in the united states,2009 Jul,2009
19543977,sexual acquisition and transmission of hiv cooperative agreement program sathcap july 2009 introduction,2009 Jul,2009
19543974,perceived mental illness stigma and hiv risk behaviors among adult psychiatric outpatients in rio de janeiro brazil,2010 Feb,2010
19543960,modulation of the proteome of peripheral blood mononuclear cells from hiv 1 infected patients by drugs of abuse,2009 Sep,2009
19543837,bridging sexual boundaries men who have sex with men and women in a street based sample in los angeles,2009 Jul,2009
19543836,identifying hidden sexual bridging communities in chicago,2009 Jul,2009
19543681,predicting in patient falls in a geriatric clinic a clinical study combining assessment data and simple sensory gait measurements,2009 Aug,2009
19543629,highly active antiretroviral therapy in hiv sero positive children disease progression by baseline clinical immunological and virological status,2009 Jun,2009
19543547,factors related to quality of life in treatment adherent successfully treated hiv patients in france,2009 Apr 30,2009
19543534,pregnancy outcomes among hiv infected women undergoing antiretroviral therapy,2009 Mar 3,2009
19543410,sexual orientation drug use preference during sex and hiv risk practices and preferences among men who specifically seek unprotected sex partners via the internet,2009 May,2009
19543402,antigen presenting cells represent targets for r5 hiv 1 infection in the first trimester pregnancy uterine mucosa,2009 Jun 22,2009
19543396,linking hiv infected tb patients to cotrimoxazole prophylaxis and antiretroviral treatment in india,2009 Jun 22,2009
19543283,hiv reservoir size and persistence are driven by t cell survival and homeostatic proliferation,2009 Aug,2009
19543143,cost of treatment and qalys lost due to genital warts data for the economic evaluation of hpv vaccines in the united kingdom,2009 Aug,2009
19543142,characteristics of men who have sex with men and women and women who have sex with women and men results from the 2003 seattle sex survey,2009 Sep,2009
19543141,human papilloma virus type and recurrence rate after surgical clearance of anal condylomata acuminata,2009 Sep,2009
19543114,randomized controlled trial of feeding a concentrated formula to infants born to women infected by human immunodeficiency virus,2009 Aug,2009
19543070,comparative outcome analysis of abo incompatible and positive crossmatch renal transplantation a single center experience,2009 Jun 27,2009
19543034,hiv treatment update released,2009 Jul,2009
19542867,knowledge of hiv status sexual risk behaviors and contraceptive need among people living with hiv in kenya and malawi,2009 Jul 31,2009
19542866,randomized double blind placebo matched multicenter trial of abacavir lamivudine or tenofovir emtricitabine with lopinavir ritonavir for initial hiv treatment,2009 Jul 31,2009
19542865,tumor necrosis factor region polymorphisms are associated with aids and with cytomegalovirus retinitis,2009 Aug 24,2009
19542864,hepatitis c virus infections among hiv infected men who have sex with men an expanding epidemic,2009 Jul 31,2009
19542863,association of abacavir and impaired endothelial function in treated and suppressed hiv infected patients,2009 Sep 24,2009
19542534,successful treatment of ifosfamide induced hyponatremia with avp receptor antagonist without interruption of hydration for prevention of hemorrhagic cystitis,2009 Jul,2009
19542198,transition to adult services among behaviorally infected adolescents with hiv a qualitative study,2011 Mar,2011
19542041,gender specific correlates of incarceration among marginally housed individuals in san francisco,2009 Aug,2009
19541896,why are hiv positive mothers refusing to have their children screened for vertically transmitted hiv infection,2009 Jul,2009
19541894,fourteen years of surveillance of hiv 1 prevalence among pregnant women attending antenatal care clinics in western uganda,2009 Jul,2009
19541893,unawareness of hiv status in pregnancy delay in testing and conflict between information on antenatal card and interview in recife brazil,2009 Jul,2009
19541889,prevention of human immunodeficiency virus mother to child transmission in israel,2009 Jul,2009
19541888,targeting of hiv pretest discussion and risk reduction interventions in a low prevalence setting,2009 Jul,2009
19541887,chlamydia trachomatis infection during pregnancy and the risk of preterm birth a case control study,2009 Jul,2009
19541885,2009 european iusti who guideline on the diagnosis and treatment of gonorrhoea in adults,2009 Jul,2009
19541883,how to contain generalized hiv epidemics a plea for better evidence to displace speculation,2009 Jul,2009
19541796,long term exposure to zidovudine delays cell cycle progression induces apoptosis and decreases telomerase activity in human hepatocytes,2009 Sep,2009
19541701,aids epidemic in south africa may be slowing survey shows,2009 Jun 18,2009
19541584,impaired cd4 cell immune reconstitution upon hiv therapy in patients with toxoplasmic encephalitis compared to patients with pneumocystis pneumonia as aids indicating disease,2009 Jun 18,2009
19541575,switch from a zdv 3tc based regimen to a completely once daily qd regimen of emtricitabine tenofovir df fixed dose combination plus a third qd agent sonett,2009 May 14,2009
19541574,wireless capsule endoscopy for the detection of small bowel diseases in hiv 1 infected patients,2009 May 14,2009
19541372,development of a platelet activating factor antagonist for hiv 1 associated neurocognitive disorders,2009 Aug 18,2009
19540543,phylodynamic analysis of the dissemination of hiv 1 crf01 ae in vietnam,2009 Aug 15,2009
19540494,ethical beliefs related to hiv and aids among nursing students in south africa and the united states a cross sectional analysis,2009 Nov,2009
19540255,note on statistical analysis of organ weights in non clinical toxicological studies,2009 Oct 1,2009
19539931,women living with hiv and aids right to prevention treatment and health care,2009 Aug,2009
19539866,syphilis mimicking tinea imbricata and erythema annulare centrifugum in an immunocompromised patient,2009 Jul,2009
19539688,glycosaminoglycan mimetics induced mobilization of hematopoietic progenitors and stem cells into mouse peripheral blood structure function insights,2009 Sep,2009
19539630,modeling hiv persistence the latent reservoir and viral blips,2009 Sep 21,2009
19539586,comparison of dna vaccines producing hiv 1 gag and lamp gag chimera in rhesus macaques reveals antigen specific t cell responses with distinct phenotypes,2009 Jul 30,2009
19539415,gender asymmetry in healthcare facility attendance of people living with hiv aids in burkina faso,2009 Sep,2009
19539413,improving mothers access to pmtct programs in west africa a public health perspective,2009 Sep,2009
19539340,changing sensitivity to broadly neutralizing antibodies b12 2g12 2f5 and 4e10 of primary subtype b human immunodeficiency virus type 1 variants in the natural course of infection,2009 Aug 1,2009
19539222,lamivudine prophylaxis and hepatitis b vaccination for prevention of hepatitis b virus reverse seroconversion in long term survivors after allogeneic stem cell transplantation,2009 Jul,2009
19539219,allogeneic hematopoietic cell transplantation in human immunodeficiency virus positive patients with hematologic disorders a report from the center for international blood and marrow transplant research,2009 Jul,2009
19539206,protective value of parental sex education a clinic based exploratory study of adolescent females,2009 Jun,2009
19538959,antiretroviral protease inhibitors potentiate chloroquine antimalarial activity in malaria parasites by regulating intracellular glutathione metabolism,2009 Oct,2009
19538939,enhanced hiv 1 neutralization by a cd4 vh3 igg1 fusion protein,2009 Aug 21,2009
19538756,characteristics and determinants of sexual behavior among adolescents of migrant workers in shangai china,2009 Jun 19,2009
19538717,coming home to die the association between migration and mortality in rural south africa,2009 Jun 18,2009
19538533,aerobic exercise training as a potential source of natural antibodies protective against human immunodeficiency virus 1,2010 Jun,2010
19538088,hiv testing in a high incidence population is antibody testing alone good enough,2009 Aug 1,2009
19537535,paediatric antiretroviral therapy outcomes under hiv hospice care in south africa,2009 Mar,2009
19537424,seroprevalence of varicella zoster antibodies among children with malnutrition malignancies and hiv infection,2008 Oct,2008
19537417,low sensitivity of t cell based detection of tuberculosis among hiv co infected tanzanian in patients,2008 Sep,2008
19537407,integration of nutrition in the antiretroviral therapy scale up plan for malawi,2008 Sep,2008
19537404,socio demographic characteristics associated with hiv and syphilis seroreactivity among pregnant women in blantyre malawi 2000 2004,2008 Sep,2008
19537399,use of thalidomide in the management of three hiv seroreactive children with kaposi s sarcoma referred for palliative care,2008 Dec,2008
19537398,audit of gynaecological cancers queen elizabeth central hospital blantyre,2008 Dec,2008
19537394,need for a national cancer policy in malawi,2008 Dec,2008
19537373,treatment of facial lipoatrophy via autologous fat transfer,2009 May,2009
19537140,persistent toxoplasma bradyzoite cysts in the brain incidental finding in an immunocompetent patient without evidence of a toxoplasmosis,2009 May-Jun,2009
19537105,hiv infection as a risk factor of professional contamination of the military medical hospital personnel,2009 Apr,2009
19537090,immunodeficiency viruses and nonhuman primate models of aids,2009 May-Jun,2009
19537001,mesenteric castleman s disease and inflammatory fibroid polyp of the stomach a case report and review of the literature,2009 Mar-Apr,2009
19536329,clinical prognostic value of rna viral load and cd4 cell counts during untreated hiv 1 infection a quantitative review,2009 Jun 17,2009
19536321,emerging role of integrase inhibitors in the management of treatment experienced patients with hiv infection,2009 Apr,2009
19535980,challenges in treating malignancies in hiv in nigeria,2009 Sep,2009
19535902,sam68 functions in nuclear export and translation of hiv 1 rna,2009 Sep-Oct,2009
19535760,idiopathic cd4 t lymphocytopenia with cryptococcal meningitis first case report from cambodia,2009 Jul,2009
19535732,no strings attached the escrt machinery in viral budding and cytokinesis,2009 Jul 1,2009
19535632,macrophage delivery of nanoformulated antiretroviral drug to the brain in a murine model of neuroaids,2009 Jul 1,2009
19535612,project ore a friendship based intervention to prevent hiv sti in urban african american adolescent females,2010 Feb,2010
19535541,beneficial effects of a combination of korean red ginseng and highly active antiretroviral therapy in human immunodeficiency virus type 1 infected patients,2009 Aug,2009
19535523,assessment of the ability of a fourth generation immunoassay for human immunodeficiency virus hiv antibody and p24 antigen to detect both acute and recent hiv infections in a high risk setting,2009 Aug,2009
19535493,immune reconstitution visceral leishmaniasis presented as hemophagocytic syndrome in a patient with aids from a nonendemic area a case report,2009 Jul-Aug,2009
19535492,cold agglutinins in hiv seropositive participants and diagnosis of respiratory disease due to mycoplasma pneumoniae,2009 Jul-Aug,2009
19535453,transitions to and from the cd4 bound conformation are modulated by a single residue change in the human immunodeficiency virus type 1 gp120 inner domain,2009 Sep,2009
19535450,patch of positively charged amino acids surrounding the human immunodeficiency virus type 1 vif slvx4yx9y motif influences its interaction with apobec3g,2009 Sep,2009
19535443,infectious molecular clone and pseudotyped virus models of human immunodeficiency virus type 1 exhibit significant differences in virion composition with only moderate differences in infectivity and inhibition sensitivity,2009 Sep,2009
19535442,cytoplasmic apobec3g restricts incoming vif positive human immunodeficiency virus type 1 and increases two long terminal repeat circle formation in activated t helper subtype cells,2009 Sep,2009
19535121,donor variation in in vitro hiv 1 susceptibility of monocyte derived macrophages,2009 Aug 1,2009
19535108,erectile aid use by men treated for localized prostate cancer,2009 Aug,2009
19535075,access to sexual and reproductive health for young people bridging the disconnect between rights and reality,2009 Aug,2009
19535069,rights to safe motherhood and newborn health ethical issues,2009 Aug,2009
19535068,healthcare workers and the brain drain,2009 Aug,2009
19534995,t cell receptor diversity of cd8 t lymphocytes and its association with viral load in individuals with hiv 1 infection,2009 May,2009
19534946,cross sectional study on rates and influential factors of standard medication for antiretroviral therapy in preventing mother to child transmission of hiv,2009 Apr,2009
19534798,challenges of establishing a community advisory board cab in a low income low resource setting experiences from bagamoyo tanzania,2009 Jun 17,2009
19534668,b mode ultrasound study of carotid plaques in hiv positive patients to detect the presence of inflammatory endothelial lesions,2009 Sep,2009
19534666,lipid changes associated with antiretroviral therapy results differ by reporting approach,2009 Sep,2009
19534665,natural killer cell receptors in human immunodeficiency virus infection pathways to protection or doors to disappointment,2009 Sep,2009
19534664,progenitor cell types in hiv 1 infection bioactivity and emerging targets for treatment,2009 Sep,2009
19534663,cerebrovascular diseases in hiv infected patients,2009 Sep,2009
19534629,near full length genome characterization of an hiv 1 crf01 ae strain in jiangsu china evidence of two independent introductions from fujian,2009 Jun,2009
19534628,short cycle therapy in adolescents after continuous therapy with established viral suppression the impact on viral load suppression,2009 Jun,2009
19534603,usefulness of highly active antiretroviral therapy on health related quality of life of adult recipients in tanzania,2009 Jul,2009
19534602,beyond anal sex sexual practices associated with hiv risk reduction among men who have sex with men in boston massachusetts,2009 Jul,2009
19534601,lymphogranuloma venerium proctitis in the setting of hiv a case report and differential diagnosis,2009 Jul,2009
19534595,interleukin 10 promoter polymorphisms influence hiv 1 susceptibility and primary hiv 1 pathogenesis,2009 Aug 1,2009
19534584,prospects for antisense peptide nucleic acid pna therapies for hiv,2009 Aug,2009
19534327,neuroaids an evolving epidemic,2009 May,2009
19534272,anthracotic pigment in pleural fluid a case report,2009 May-Jun,2009
19527820,series of critically challenging case scenarios in moderate to severe psoriasis a delphi consensus approach,2009 Jul,2009
19533884,risk behaviors for hiv aids among youth in rural area of myanmar,2008 Oct,2008
19533873,impact of the hiv epidemic on health services in cambodia a delphi study,2008 Oct,2008
19533652,infection of t lymphocytes in non asian patients with epstein barr virus associated hemophagocytic lymphohistiocytosis,2009 Dec 15,2009
19533511,putting mental health on the agenda for hiv women a review of evidence from sub saharan africa,2009 Mar-May,2009
19533506,spiritual well being depressive symptoms and immune status among women living with hiv aids,2009 Mar-May,2009
19533368,potential bridges of heterosexual hiv transmission from drug users to the general population in st petersburg russia is it easy to be a young female,2009 Jul,2009
19533366,limited utility of name based tuberculosis contact investigations among persons using illicit drugs results of an outbreak investigation,2009 Sep,2009
19533363,risky business focus group analysis of sexual behaviors drug use and victimization among incarcerated women in st louis,2009 Sep,2009
19533349,perceived social support and psychosocial distress among children affected by aids in china,2010 Feb,2010
19533323,lack of understanding of acute hiv infection among newly infected persons implications for prevention and public health the nimh multisite acute hiv infection study ii,2009 Dec,2009
19533322,preferences for characteristics of antiretroviral therapy provision in johannesburg south africa results of a conjoint analysis,2010 Aug,2010
19532085,recurrent bacterial vaginosis,2009 Feb,2009
19532082,web 2 0 and beyond risks for sexually transmitted infections and opportunities for prevention,2009 Feb,2009
19532081,manifestations and management of lymphogranuloma venereum,2009 Feb,2009
19532080,autoimmunity and hiv,2009 Feb,2009
19532078,cardiovascular disease and hiv infection host virus or drugs,2009 Feb,2009
19532076,multidrug resistant and extensively drug resistant tuberculosis consequences for the global hiv community,2009 Feb,2009
19532075,non aids defining cancers,2009 Feb,2009
19532074,haemophagocytic syndrome and hiv,2009 Feb,2009
19532072,epidemiology of hiv associated tuberculosis,2009 Jul,2009
19532071,current issues in prevention of mother to child transmission of hiv 1,2009 Jul,2009
19532068,global epidemic of hiv infection among men who have sex with men,2009 Jul,2009
19532067,herpes simplex virus type 2 and syphilis infections with hiv an evolving synergy in transmission and prevention,2009 Jul,2009
19532066,hiv in adolescents in sub saharan africa,2009 Jul,2009
19532065,secondary prevention of hiv infection the current state of prevention for positives,2009 Jul,2009
19532064,methodologies for evaluating hiv prevention intervention populations and epidemiologic settings,2009 Jul,2009
19532063,hiv prevention science at a crossroads advances in reducing sexual risk,2009 Jul,2009
19532062,hiv transmission networks,2009 Jul,2009
19532061,advances and future directions in hiv surveillance in low and middle income countries,2009 Jul,2009
19532059,global epidemiology of hiv,2009 Jul,2009
19532052,immunopathogenesis of asymptomatic chronic hiv infection the calm before the storm,2009 May,2009
19532050,improvements in antiretroviral therapy outcomes over calendar time,2009 May,2009
19532049,immunotherapies in hiv 1 infection,2009 May,2009
19532048,cancer the effects of hiv and antiretroviral therapy and implications for early antiretroviral therapy initiation,2009 May,2009
19532047,consequences of hiv infection and antiretroviral therapy use for cardiovascular disease risk shifting paradigms,2009 May,2009
19532046,liver disease the effects of hiv and antiretroviral therapy and the implications for early antiretroviral therapy initiation,2009 May,2009
19532045,renal disease the effects of hiv and antiretroviral therapy and the implications for early antiretroviral therapy initiation,2009 May,2009
19532024,appraisal of smoking cessation aids,2009 Mar,2009
19531981,pharmacokinetics of plasma efavirenz and cyp2b6 polymorphism in southern chinese,2009 Aug,2009
19531929,continuous antiretroviral therapy decreases bone mineral density,2009 Jul 31,2009
19531928,switching to second line antiretroviral therapy in resource limited settings comparison of programmes with and without viral load monitoring,2009 Sep 10,2009
19531927,characteristics of and outcomes in hiv infected patients who return to care after loss to follow up,2009 Aug 24,2009
19531926,prognosis of hiv associated non hodgkin lymphoma in patients starting combination antiretroviral therapy,2009 Sep 24,2009
19531618,systematic review of interventions to improve recall of medical advice in healthcare consultations,2009 Jun,2009
19531316,hiv seroprevalence and associated risk factors among male inmates at the belize central prison,2009 Apr,2009
19531242,anemia and growth failure among hiv infected children in india a retrospective analysis,2009 Jun 16,2009
19531216,near full length genome analysis of low prevalent human immunodeficiency virus type 1 subclade f1 in s o paulo brazil,2009 Jun 16,2009
19531211,effectiveness of antiretroviral therapy and development of drug resistance in hiv 1 infected patients in mombasa kenya,2009 Jun 16,2009
19531207,serial evolutionary networks of within patient hiv 1 sequences reveal patterns of evolution of x4 strains,2009 Jun 16,2009
19530956,antiretroviral treatment in pregnancy a six year perspective on recent trends in prescription patterns viral load suppression and pregnancy outcomes,2009 Jul,2009
19530955,sex risk practices among hiv positive individuals in buenos aires argentina,2009 Jul,2009
19530953,field evaluation of diagnostic accuracy of an oral fluid rapid test for hiv tested at point of service sites in rural zimbabwe,2009 Jul,2009
19530952,recurrent community associated methicillin resistant staphylococcus aureus infections among hiv infected persons incidence and risk factors,2009 Jul,2009
19530941,detection of wu polyomavirus in cerebrospinal fluid specimen from a patient with aids and suspected progressive multifocal leukoencephalopathy,2009 Jul 15,2009
19530940,impact of acyclovir on genital and plasma hiv 1 rna genital herpes simplex virus type 2 dna and ulcer healing among hiv 1 infected african women with herpes ulcers a randomized placebo controlled trial,2009 Jul 15,2009
19530571,advancing the africentric paradigm shift discourse building toward evidence based africentric interventions in social work practice with african americans,2009 Jul,2009
19530567,what african american male adolescents are telling us about hiv infection among their peers cultural approaches for hiv prevention,2009 Jul,2009
